{
  "schema_version": "0.9.0",
  "maturity": {
    "rung": "sandbox",
    "entered_at": "2026-09-01",
    "notes": "Synthetic. Generated by examples/make_examples.py to exercise the schema end to end, and not a measurement of anything. Nothing downstream should treat it as data."
  },
  "sample_id": "SYNTH-CATALYST-001",
  "status": "ok",
  "catalyst_family": "synthetic supported oxide",
  "identifiers": {
    "formula": "VOx/SiO2"
  },
  "composition": {
    "nominal": {
      "V": {
        "value": 3.0,
        "units": "wt%"
      }
    },
    "measured": {
      "V": {
        "value": 2.84,
        "sigma": 0.09,
        "units": "wt%",
        "method": "XRF"
      }
    },
    "support": "SiO2"
  },
  "synthesis": {
    "method": "incipient wetness impregnation",
    "precursors": [
      {
        "name": "ammonium metavanadate",
        "identifiers": {
          "formula": "NH4VO3",
          "cas": "7803-55-6"
        },
        "supplier": "SYNTHETIC",
        "lot": "SYNTHETIC-LOT-A",
        "purity": "99.9%"
      },
      {
        "name": "silica gel",
        "identifiers": {
          "formula": "SiO2"
        },
        "supplier": "SYNTHETIC"
      }
    ],
    "thermal_treatments": [
      {
        "label": "drying",
        "temperature_K": 373.0,
        "duration_s": 43200,
        "atmosphere": "air"
      },
      {
        "label": "calcination",
        "temperature_K": 823.0,
        "ramp_K_per_min": 2.0,
        "duration_s": 14400,
        "atmosphere": "air",
        "flow_sccm": 50.0
      }
    ],
    "date": "2026-08-25T10:00:00Z",
    "notes": "SYNTHETIC. No such sample exists."
  },
  "properties": {
    "surface_area": {
      "value": 212.0,
      "sigma": 4.0,
      "units": "m^2/g",
      "method": "BET N2 physisorption"
    },
    "reducibility_T_max": {
      "value": 723.0,
      "sigma": 8.0,
      "units": "K",
      "method": "H2-TPR",
      "notes": "The kind of property a fitted rate constant gets correlated against."
    },
    "v_surface_density": {
      "value": 2.3,
      "sigma": 0.2,
      "units": "V/nm^2",
      "method": "XRF + BET"
    }
  },
  "characterization": [
    {
      "technique": "XRF",
      "summary": "2.84 wt% V, no crystalline V2O5 detected."
    },
    {
      "technique": "N2 physisorption",
      "summary": "212 m^2/g, type IV isotherm."
    }
  ],
  "batch_id": "synthetic-batch-a",
  "quantity_g": 2.5,
  "location": "gt",
  "access_status": "public",
  "license": "CC-BY-4.0",
  "funding": [
    {
      "funder": "US Department of Energy",
      "award": "DE-FOA-0003612",
      "program": "Genesis Mission"
    }
  ],
  "project": "genesis-prbs-phase-1",
  "notes": "SYNTHETIC EXEMPLAR. Stored at ambient in a sealed vial; no pretreatment beyond the calcination recorded above. Present so every field of the sample schema has a worked value."
}
